{
  "rubric_version": "v1.6.0",
  "data_as_of": "2026-05-12T04:06:37Z",
  "generated_at": "2026-05-12T04:06:40Z",
  "data": {
    "hack_data": {
      "hack": {
        "id": "bearn",
        "protocol_slug": null,
        "protocol_name": "bEarnFi (BvaultsBank)",
        "occurred_at": "2021-05-16",
        "loss_usd": 18000000.0,
        "category": "Yield Aggregator / Vault",
        "root_cause": "Logic bug — token denomination mismatch between vault and strategy layers",
        "description": "A $18M denomination mismatch between bEarn's bank and strategy contracts let an attacker use a flash loan to withdraw more than deposited in an iterative loop.",
        "postmortem_url": null,
        "funds_recovered_pct": null,
        "is_active": false,
        "status": "closed"
      },
      "linked_factors": [
        {
          "factor_id": "RD-F-001",
          "relevance": "causal",
          "notes": "★ Direct: Audit scope mismatch (report commit ≠ deployed bytecode) [via cross-hack: Factor 1: Audit Scope Mismatch]"
        },
        {
          "factor_id": "RD-F-004",
          "relevance": "causal",
          "notes": "Audit count likely 0; floor display [via dashboard_risk_factors/Vulnerability in audited or unaudited code: Unaudited code]"
        },
        {
          "factor_id": "RD-F-006",
          "relevance": "causal",
          "notes": "Audit-deploy gap (RD-F-006 time between audit and deploy) [via dashboard_risk_factors/Exploited code newly deployed/upgraded: Unknown — rekt report does not specify recent deployment] || Audit-deploy gap — alternate field name [via dashboard_risk_factors/Exploited code newly deployed/upgraded: Unknown — rekt report does not specify recent deployment]"
        },
        {
          "factor_id": "RD-F-007",
          "relevance": "causal",
          "notes": "Direct: bug bounty presence + max payout [via cross-hack: Factor 9: No Bug Bounty Program] || Bug bounty absent — baseline integrity gap [via dashboard_risk_factors/Bug bounty: Unknown — not mentioned in report]"
        },
        {
          "factor_id": "RD-F-050",
          "relevance": "causal",
          "notes": "Dependency graph [via cross-hack: Factor 6: Cross-Protocol / Composability Complexity]"
        },
        {
          "factor_id": "RD-F-052",
          "relevance": "related",
          "notes": "Breakage analysis [via cross-hack: Factor 6: Cross-Protocol / Composability Complexity]"
        },
        {
          "factor_id": "RD-F-061",
          "relevance": "causal",
          "notes": "Protocol trusts LP token balanceOf for pricing [via cross-hack: Factor 11: Multi-Layer Vault/Strategy Architecture With Cross-Token Accounting]"
        },
        {
          "factor_id": "RD-F-074",
          "relevance": "related",
          "notes": "ERC-4626 virtual-share offset [via cross-hack: Factor 11: Multi-Layer Vault/Strategy Architecture With Cross-Token Accounting]"
        },
        {
          "factor_id": "RD-F-100",
          "relevance": "illustrative",
          "notes": "Flash loan > $10M origination — RT signal [via realtime_signals/Unusual borrowing: Y — large flash loan from CREAM ($7.8M BUSD) as exploit initiator]"
        },
        {
          "factor_id": "RD-F-111",
          "relevance": "causal",
          "notes": "Team doxx status — pseudonymous-no-track-record class [via dashboard_risk_factors/Team anonymity: Anonymous]"
        },
        {
          "factor_id": "RD-F-126",
          "relevance": "causal",
          "notes": "Is-a-fork-of (Cat 8 anchor) [via dashboard_risk_factors/Forked: Y — described as \"copied code\" from other BSC protocols; typical BSC fork pattern]"
        },
        {
          "factor_id": "RD-F-146",
          "relevance": "related",
          "notes": "New deploys in last 30 days — fresh attack surface [via dashboard_risk_factors/Exploited code newly deployed/upgraded: Unknown — rekt report does not specify recent deployment]"
        }
      ]
    }
  }
}