{
  "rubric_version": "v1.6.0",
  "data_as_of": "2026-05-12T04:06:37Z",
  "generated_at": "2026-05-12T04:06:40Z",
  "data": {
    "hack_data": {
      "hack": {
        "id": "superfluid-rekt",
        "protocol_slug": null,
        "protocol_name": "Superfluid",
        "occurred_at": "2022-02-08",
        "loss_usd": 8700000.0,
        "category": "Streaming Payment Protocol / Infrastructure",
        "root_cause": "Composability Exploit (ctx Manipulation)",
        "description": "An attacker forged Superfluid's internal transaction state (ctx) to impersonate privileged calls, draining $8.7M from protocols that used Superfluid for contributor payments — crashing Mai Finance's QI token 80% as the loot was dumped.",
        "postmortem_url": null,
        "funds_recovered_pct": null,
        "is_active": false,
        "status": "closed"
      },
      "linked_factors": [
        {
          "factor_id": "RD-F-007",
          "relevance": "related",
          "notes": "Bug bounty absent — baseline integrity gap [via dashboard_risk_factors/Bug bounty: Unknown]"
        }
      ]
    }
  }
}