{
  "rubric_version": "v1.6.0",
  "data_as_of": "2026-07-29T09:00:00Z",
  "generated_at": "2026-07-29T09:00:00Z",
  "data": {
    "factor_data": {
      "factor": {
        "id": "RD-F-160",
        "category_id": 11,
        "name": "GitHub malicious-dependency incident touching protocol deps",
        "description": "Determine whether a security advisory flags a malicious release in a dependency consumed by this protocol.",
        "scoring_methodology": "**What this measures**\nThis episodic signal fires when a security advisory on GitHub (GHSA), npm, PyPI, or crates.io flags a malicious release or critical vulnerability in a package that is a direct or transitive dependency of the monitored protocol's deployment pipeline or frontend. The signal is generated by cross-referencing the protocol's dependency manifest (package.json, Cargo.toml, requirements.txt) against the GitHub Advisory Database and the OSV vulnerability feed. Category 11 context: malicious dependency injection (software supply-chain attack) represents an attacker-side vector that bypasses smart contract audits entirely by compromising the build or deployment toolchain.\n\n**Why it matters**\nThe XZ Utils supply-chain attack (March 2024) demonstrated that a two-year contribution pattern could precede a single malicious commit to a widely-used package. In DeFi, supply-chain attacks on npm packages used in frontend code or deployment scripts could enable unauthorized contract deployments or transaction manipulation. Team Finance ($14M, 2021) involved a migrate() function exploit — the attack vector was not a dependency compromise but the pattern of trusting third-party tooling without independent verification is the same. The Cetus Protocol case ($223M, 2025) involved a shared math library bug across four protocols — a supply-chain contagion pattern. GitHub Advisory monitoring provides automated tracking of the upstream dependency risk surface.\n\n**Green / Yellow / Red**\nGreen is the baseline when no current GHSA advisories or malicious-release flags exist for any package in the protocol's declared dependency manifest. Yellow fires when a moderate-severity advisory affects a transitive dependency (three or more hops removed from the protocol's direct imports) — real but distant risk. Red fires when a high or critical advisory — including a confirmed malicious-release flag — affects a direct dependency of the protocol's smart contract compilation pipeline or deployment scripts.\n\n**Common gray cases**\nGray applies when the protocol's dependency manifest is not publicly accessible or uses private package registries not covered by public advisory feeds, or when the protocol's smart contracts are compiled with no npm/PyPI dependencies (e.g., pure Foundry with pinned lib versions via git submodules).\n\n**Notable historical examples**\nNo cross-hacked incidents currently linked in database for this factor.",
        "is_critical": false,
        "curation_archetype": "PE",
        "measurement": "Determine whether a security advisory flags a malicious release in a dependency consumed by this protocol.",
        "data_source": "GitHub Security Advisories (GHSA) feed + protocol dependency manifest (from F134)",
        "method": "PE",
        "output_format": "binary-flag",
        "cadence": "E",
        "evidence_artifact": "GHSA advisory URL + affected package + affected version range + this protocol's installed version",
        "confidence_signal": "green = no active malicious-release advisory affecting this protocol's dependencies; red = active advisory confirmed for used dependency; gray = dependency list not accessible",
        "introduced_in_rubric": "v1.5.0",
        "deprecated_in_rubric": null
      },
      "scored_protocols": [],
      "linked_hacks": []
    }
  }
}
