{
  "rubric_version": "v1.6.0",
  "data_as_of": "2026-05-12T04:06:37Z",
  "generated_at": "2026-05-12T04:06:40Z",
  "data": {
    "hack_data": {
      "hack": {
        "id": "abracadabra-rekt2",
        "protocol_slug": null,
        "protocol_name": "Abracadabra Money",
        "occurred_at": "2025-03-25",
        "loss_usd": 13000000.0,
        "category": "CDP / Lending (Cauldron-style isolated markets)",
        "root_cause": "Logic bug — phantom collateral / post-liquidation state inconsistency",
        "description": "Abracadabra lost $13M when attackers discovered that self-liquidating a position didn't cancel a pending GMX order, letting them borrow against collateral the protocol had already wiped.",
        "postmortem_url": null,
        "funds_recovered_pct": null,
        "is_active": false,
        "status": "closed"
      },
      "linked_factors": [
        {
          "factor_id": "RD-F-006",
          "relevance": "causal",
          "notes": "Audit-deploy gap (RD-F-006 time between audit and deploy) [via dashboard_risk_factors/Exploited code newly deployed/upgraded: Y — gmCauldron integration with GMX was a relatively new module] || Audit-deploy gap — alternate field name [via dashboard_risk_factors/Exploited code newly deployed/upgraded: Y — gmCauldron integration with GMX was a relatively new module]"
        },
        {
          "factor_id": "RD-F-007",
          "relevance": "related",
          "notes": "Bug bounty absent — baseline integrity gap [via dashboard_risk_factors/Bug bounty: Unknown / not mentioned in report]"
        },
        {
          "factor_id": "RD-F-050",
          "relevance": "causal",
          "notes": "Dependency graph [via cross-hack: Factor 6: Cross-Protocol / Composability Complexity]"
        },
        {
          "factor_id": "RD-F-052",
          "relevance": "related",
          "notes": "Breakage analysis [via cross-hack: Factor 6: Cross-Protocol / Composability Complexity]"
        },
        {
          "factor_id": "RD-F-077",
          "relevance": "causal",
          "notes": "Prior exploit count [via cross-hack: Factor 5: Second Exploit on Same Protocol]"
        },
        {
          "factor_id": "RD-F-078",
          "relevance": "causal",
          "notes": "Chronic flag (≥3 prior exploits) [via cross-hack: Factor 5: Second Exploit on Same Protocol]"
        },
        {
          "factor_id": "RD-F-079",
          "relevance": "causal",
          "notes": "Same-root-cause repeat exploit [via cross-hack: Factor 5: Second Exploit on Same Protocol]"
        },
        {
          "factor_id": "RD-F-146",
          "relevance": "related",
          "notes": "New deploys in last 30 days — fresh attack surface [via dashboard_risk_factors/Exploited code newly deployed/upgraded: Y — gmCauldron integration with GMX was a relatively new module]"
        }
      ]
    }
  }
}