{
  "rubric_version": "v1.6.0",
  "data_as_of": "2026-05-12T04:06:37Z",
  "generated_at": "2026-05-12T04:06:40Z",
  "data": {
    "hack_data": {
      "hack": {
        "id": "pancakebunny-rekt",
        "protocol_slug": null,
        "protocol_name": "PancakeBunny",
        "occurred_at": "2021-05-19",
        "loss_usd": 45000000.0,
        "category": "Yield Aggregator / Vault",
        "root_cause": "Flash loan + spot price manipulation → inflated LP token valuation → excess BUNNY minting",
        "description": "PancakeBunny lost $45M when an attacker used 8 coordinated flash loans to inflate the spot price of LP tokens, minting 6.97M BUNNY tokens as fraudulent rewards before dumping them and crashing BUNNY 96%.",
        "postmortem_url": null,
        "funds_recovered_pct": null,
        "is_active": false,
        "status": "closed"
      },
      "linked_factors": [
        {
          "factor_id": "RD-F-001",
          "relevance": "causal",
          "notes": "★ Audit scope mismatch — exploited code outside scope [via dashboard_risk_factors/Was exploited code in audit scope?: N — Haechi audited the original contracts; the team upgraded to new contracts (VaultFlipToFlip) without a new audit. Haechi's post-incident ...] || ★ Audit scope mismatch — full field name [via dashboard_risk_factors/Was exploited code in audit scope?: N — Haechi audited the original contracts; the team upgraded to new contracts (VaultFlipToFlip) without a new audit. Haechi's post-incident ...] || ★ Direct: Audit scope mismatch (report commit ≠ deployed bytecode) [via cross-hack: Factor 1: Audit Scope Mismatch]"
        },
        {
          "factor_id": "RD-F-004",
          "relevance": "causal",
          "notes": "Audit count likely 0; floor display [via dashboard_risk_factors/Vulnerability in audited or unaudited code: Unaudited — the exploited vault code was a post-audit upgrade]"
        },
        {
          "factor_id": "RD-F-006",
          "relevance": "causal",
          "notes": "Audit-deploy gap (RD-F-006 time between audit and deploy) [via dashboard_risk_factors/Exploited code newly deployed/upgraded?: Y — VaultFlipToFlip was a new upgrade not audited by Haechi] || Audit-deploy gap — alternate field name [via dashboard_risk_factors/Exploited code newly deployed/upgraded?: Y — VaultFlipToFlip was a new upgrade not audited by Haechi] || Time between audit end and deploy [via cross-hack: Factor 4: Newly Deployed or Unannounced Contract] || (+1 more matches)"
        },
        {
          "factor_id": "RD-F-007",
          "relevance": "causal",
          "notes": "Direct: bug bounty presence + max payout [via cross-hack: Factor 9: No Bug Bounty Program] || Bug bounty absent — baseline integrity gap [via dashboard_risk_factors/Bug bounty: Unknown]"
        },
        {
          "factor_id": "RD-F-099",
          "relevance": "illustrative",
          "notes": "Oracle price deviation > X% from secondary source — RT signal would have fired [via realtime_signals/Oracle anomaly: Y — WBNB/BUSDT LP token valuation would have shown extreme anomaly during the swap manipulation window]"
        },
        {
          "factor_id": "RD-F-100",
          "relevance": "illustrative",
          "notes": "Flash loan > $10M origination — RT signal [via realtime_signals/Unusual borrowing: Y — 8 simultaneous flash loans from different sources is highly anomalous]"
        },
        {
          "factor_id": "RD-F-111",
          "relevance": "causal",
          "notes": "Team doxx status — pseudonymous-no-track-record class [via dashboard_risk_factors/Team anonymity: Unknown]"
        },
        {
          "factor_id": "RD-F-126",
          "relevance": "causal",
          "notes": "Is-a-fork-of (Cat 8 anchor) [via dashboard_risk_factors/Forked?: Y — BSC yield aggregator forking concepts from Yearn and Bunny-style vaults]"
        },
        {
          "factor_id": "RD-F-139",
          "relevance": "causal",
          "notes": "★ Post-audit code changes deployed without re-audit [via cross-hack: Factor 21: Post-Audit Code Change Without Re-Audit]"
        },
        {
          "factor_id": "RD-F-141",
          "relevance": "related",
          "notes": "Test-mode parameters left on in deploy (possibly related) [via cross-hack: Factor 4: Newly Deployed or Unannounced Contract]"
        },
        {
          "factor_id": "RD-F-146",
          "relevance": "related",
          "notes": "New deploys in last 30 days (fresh attack surface) [via cross-hack: Factor 4: Newly Deployed or Unannounced Contract] || New deploys in last 30 days — fresh attack surface [via dashboard_risk_factors/Exploited code newly deployed/upgraded?: Y — VaultFlipToFlip was a new upgrade not audited by Haechi]"
        }
      ]
    }
  }
}