{
  "rubric_version": "v1.6.0",
  "data_as_of": "2026-05-12T04:06:37Z",
  "generated_at": "2026-05-12T04:06:40Z",
  "data": {
    "hack_data": {
      "hack": {
        "id": "wormhole-rekt",
        "protocol_slug": "wormhole",
        "protocol_name": "Wormhole Bridge (Solana ↔ Ethereum)",
        "occurred_at": "2022-02-02",
        "loss_usd": 326000000.0,
        "category": "Cross-Chain Bridge",
        "root_cause": "Signature verification bypass via deprecated sysvar → fraudulent SignatureSet → fake mint of 120k wETH on Solana",
        "description": "Wormhole's Solana bridge was tricked into minting 120,000 wETH backed by nothing, by exploiting a subtle discrepancy in Solana's sysvar API that bypassed guardian signature verification.",
        "postmortem_url": null,
        "funds_recovered_pct": null,
        "is_active": false,
        "status": "closed"
      },
      "linked_factors": [
        {
          "factor_id": "RD-F-007",
          "relevance": "illustrative",
          "notes": "Bug bounty absent — baseline integrity gap [via dashboard_risk_factors/Bug bounty: Unknown — no public bug bounty program referenced; post-exploit the team offered a $10M whitehat bounty]"
        },
        {
          "factor_id": "RD-F-077",
          "relevance": "related",
          "notes": "Auto-linked by C.4 triage 2026-05-07"
        }
      ]
    }
  }
}